{
  "capabilities": {
    "assembly": true,
    "beam": false,
    "bend": false,
    "boltGroup": false,
    "booleanPart": true,
    "contourArcEdges": false,
    "contourChamfer": false,
    "contourPlate": true,
    "developedPlate": false,
    "developedPlatePolyBeamStationFrameV1": false,
    "edgeChamfer": false,
    "fitting": false,
    "loftedPlate": false,
    "polyBeam": false,
    "polyBeamArcSegments": false,
    "polygonWeld": false,
    "reinforcement": false,
    "roundHole": false,
    "slottedHole": false,
    "udaStamp": true,
    "weld": true
  },
  "commands": [
    {
      "commandId": "element:support:create-contour-plate",
      "contour": {
        "edges": [
          {
            "endVertexId": "b",
            "id": "e0",
            "kind": "line",
            "startVertexId": "a"
          },
          {
            "endVertexId": "c",
            "id": "e1",
            "kind": "line",
            "startVertexId": "b"
          },
          {
            "endVertexId": "d",
            "id": "e2",
            "kind": "line",
            "startVertexId": "c"
          },
          {
            "endVertexId": "a",
            "id": "e3",
            "kind": "line",
            "startVertexId": "d"
          }
        ],
        "id": "outer",
        "vertices": [
          {
            "id": "a",
            "point": [
              0,
              0
            ]
          },
          {
            "id": "b",
            "point": [
              100,
              0
            ]
          },
          {
            "id": "c",
            "point": [
              100,
              50
            ]
          },
          {
            "id": "d",
            "point": [
              0,
              50
            ]
          }
        ]
      },
      "dependsOn": [],
      "extrusionSide": "symmetric",
      "kind": "create-contour-plate",
      "material": {
        "id": "steel"
      },
      "owner": {
        "entityId": "support-owner",
        "moduleId": "bridge"
      },
      "ownership": {
        "documentSourceHash": "hash",
        "generationId": "g",
        "moduleId": "bridge",
        "moduleVariantId": "v",
        "namespace": "bimplatforma",
        "revisionId": "r",
        "sourceId": "support",
        "sourceKind": "element",
        "stableKey": "bridge/support"
      },
      "phase": "base-parts",
      "plane": {
        "axisX": [
          0.8,
          0.6,
          0
        ],
        "axisY": [
          -0.3,
          0.4,
          0.8660254037844386
        ],
        "axisZ": [
          0.5196152422706631,
          -0.6928203230275509,
          0.5
        ],
        "origin": [
          135,
          -90,
          1.6987298107780688
        ]
      },
      "revisionProvenance": {
        "adapterId": "test",
        "adapterVersion": "1",
        "revisionId": "r",
        "sourceHash": "hash"
      },
      "source": {
        "id": "support",
        "kind": "element",
        "role": "web",
        "sourceLayer": "generated",
        "stableKey": "bridge/support"
      },
      "thicknessMm": 20
    },
    {
      "commandId": "element:web:create-contour-plate",
      "contour": {
        "edges": [
          {
            "endVertexId": "b",
            "id": "e0",
            "kind": "line",
            "startVertexId": "a"
          },
          {
            "endVertexId": "c",
            "id": "e1",
            "kind": "line",
            "startVertexId": "b"
          },
          {
            "endVertexId": "d",
            "id": "e2",
            "kind": "line",
            "startVertexId": "c"
          },
          {
            "endVertexId": "a",
            "id": "e3",
            "kind": "line",
            "startVertexId": "d"
          }
        ],
        "id": "outer",
        "vertices": [
          {
            "id": "a",
            "point": [
              0,
              0
            ]
          },
          {
            "id": "b",
            "point": [
              100,
              0
            ]
          },
          {
            "id": "c",
            "point": [
              100,
              50
            ]
          },
          {
            "id": "d",
            "point": [
              0,
              50
            ]
          }
        ]
      },
      "dependsOn": [],
      "extrusionSide": "symmetric",
      "kind": "create-contour-plate",
      "material": {
        "id": "steel"
      },
      "owner": {
        "entityId": "web-owner",
        "moduleId": "bridge"
      },
      "ownership": {
        "documentSourceHash": "hash",
        "generationId": "g",
        "moduleId": "bridge",
        "moduleVariantId": "v",
        "namespace": "bimplatforma",
        "revisionId": "r",
        "sourceId": "web",
        "sourceKind": "element",
        "stableKey": "bridge/web"
      },
      "phase": "base-parts",
      "plane": {
        "axisX": [
          0.8,
          0.6,
          0
        ],
        "axisY": [
          -0.3,
          0.4,
          0.8660254037844386
        ],
        "axisZ": [
          0.5196152422706631,
          -0.6928203230275509,
          0.5
        ],
        "origin": [
          120,
          -70,
          45
        ]
      },
      "revisionProvenance": {
        "adapterId": "test",
        "adapterVersion": "1",
        "revisionId": "r",
        "sourceHash": "hash"
      },
      "source": {
        "id": "web",
        "kind": "element",
        "role": "web",
        "sourceLayer": "generated",
        "stableKey": "bridge/web"
      },
      "thicknessMm": 20
    },
    {
      "commandId": "feature:prep:edge-preparation-positive",
      "cutter": {
        "contour": {
          "edges": [
            {
              "endVertexId": "prep/cutter-positive/run",
              "id": "prep/cutter-positive/edge-run",
              "kind": "line",
              "startVertexId": "prep/cutter-positive/origin"
            },
            {
              "endVertexId": "prep/cutter-positive/depth",
              "id": "prep/cutter-positive/edge-slope",
              "kind": "line",
              "startVertexId": "prep/cutter-positive/run"
            },
            {
              "endVertexId": "prep/cutter-positive/origin",
              "id": "prep/cutter-positive/edge-depth",
              "kind": "line",
              "startVertexId": "prep/cutter-positive/depth"
            }
          ],
          "id": "prep/cutter-positive",
          "vertices": [
            {
              "id": "prep/cutter-positive/origin",
              "point": [
                0,
                0
              ]
            },
            {
              "id": "prep/cutter-positive/run",
              "point": [
                4.618802153517006,
                0
              ]
            },
            {
              "id": "prep/cutter-positive/depth",
              "point": [
                0,
                8
              ]
            }
          ]
        },
        "extrusionSide": "positive",
        "kind": "through-contour",
        "plane": {
          "axisX": [
            -0.3,
            0.4,
            0.8660254037844386
          ],
          "axisY": [
            -0.5196152422706631,
            0.6928203230275509,
            -0.5
          ],
          "axisZ": [
            -0.8,
            -0.6,
            0
          ],
          "origin": [
            205.19615242270663,
            -16.928203230275507,
            50
          ]
        },
        "thicknessMm": 100
      },
      "dependsOn": [
        "element:web:create-contour-plate"
      ],
      "kind": "apply-boolean-cut",
      "owner": {
        "entityId": "web-owner",
        "moduleId": "bridge"
      },
      "ownership": {
        "documentSourceHash": "hash",
        "generationId": "g",
        "moduleId": "bridge",
        "moduleVariantId": "v",
        "namespace": "bimplatforma",
        "revisionId": "r",
        "sourceId": "prep",
        "sourceKind": "feature",
        "stableKey": "bridge/contact/prep"
      },
      "phase": "boolean-cuts",
      "revisionProvenance": {
        "adapterId": "test",
        "adapterVersion": "1",
        "revisionId": "r",
        "sourceHash": "hash"
      },
      "source": {
        "id": "prep",
        "kind": "feature",
        "role": "preparation",
        "sourceLayer": "generated",
        "stableKey": "bridge/contact/prep"
      },
      "target": {
        "elementId": "web",
        "path": [
          "support-contact"
        ],
        "role": "joint-contact"
      }
    },
    {
      "commandId": "feature:prep:edge-preparation-negative",
      "cutter": {
        "contour": {
          "edges": [
            {
              "endVertexId": "prep/cutter-negative/run",
              "id": "prep/cutter-negative/edge-run",
              "kind": "line",
              "startVertexId": "prep/cutter-negative/origin"
            },
            {
              "endVertexId": "prep/cutter-negative/depth",
              "id": "prep/cutter-negative/edge-slope",
              "kind": "line",
              "startVertexId": "prep/cutter-negative/run"
            },
            {
              "endVertexId": "prep/cutter-negative/origin",
              "id": "prep/cutter-negative/edge-depth",
              "kind": "line",
              "startVertexId": "prep/cutter-negative/depth"
            }
          ],
          "id": "prep/cutter-negative",
          "vertices": [
            {
              "id": "prep/cutter-negative/origin",
              "point": [
                0,
                0
              ]
            },
            {
              "id": "prep/cutter-negative/run",
              "point": [
                4.618802153517006,
                0
              ]
            },
            {
              "id": "prep/cutter-negative/depth",
              "point": [